{
  "schema_version": "evidence-status/v1",
  "document_id": "rev-a5-led-trigger-evidence-status",
  "description": "Offline evidence-status snapshot for Rev A5 LED gate, camera trigger, current-limit, rail-limit, output-state, and approval facts. This file is documentation/data only and is not a hardware test procedure.",
  "required_unknowns": [
    "led_current_limit.af_red",
    "led_current_limit.af_green",
    "led_current_limit.white_bf",
    "rail_limit.led_supply_voltage",
    "rail_limit.led_supply_current_budget",
    "rail_limit.controller_board_led_rail",
    "pin_mapping.driver.af_red_led_connector",
    "pin_mapping.driver.af_green_led_connector",
    "pin_mapping.driver.white_bf_led_connector",
    "output_type.camera_trigger",
    "output_type.af_red_led_gate",
    "output_type.af_green_led_gate",
    "output_type.white_bf_led_gate",
    "output_state.mks_led_gates_at_boot",
    "output_state.camera_trigger_at_boot",
    "output_state.arduino_pwm_at_boot_reset",
    "output_state.led_driver_fault_default",
    "camera_trigger_behavior.electrical_compatibility",
    "camera_trigger_behavior.boot_reset_state",
    "test_prerequisite.dummy_load_led_driver",
    "test_prerequisite.low_current_led_test",
    "approval.actual_led_connection",
    "approval.camera_trigger_connection",
    "approval.nonzero_led_current_setpoint",
    "approval.common_reference_or_isolation_plan"
  ],
  "live_action_gates": [
    {
      "id": "trigger_led_no_guess_gate",
      "title": "Trigger and LED no-guess gate",
      "status": "prohibited_by_unknowns",
      "approved": false,
      "executed": false,
      "blocked_by": [
        "led_current_limit.af_red",
        "led_current_limit.af_green",
        "led_current_limit.white_bf",
        "rail_limit.led_supply_voltage",
        "rail_limit.led_supply_current_budget",
        "rail_limit.controller_board_led_rail",
        "pin_mapping.driver.af_red_led_connector",
        "pin_mapping.driver.af_green_led_connector",
        "pin_mapping.driver.white_bf_led_connector",
        "output_type.camera_trigger",
        "output_type.af_red_led_gate",
        "output_type.af_green_led_gate",
        "output_type.white_bf_led_gate",
        "output_state.mks_led_gates_at_boot",
        "output_state.camera_trigger_at_boot",
        "output_state.arduino_pwm_at_boot_reset",
        "output_state.led_driver_fault_default",
        "camera_trigger_behavior.electrical_compatibility",
        "camera_trigger_behavior.boot_reset_state",
        "test_prerequisite.dummy_load_led_driver",
        "test_prerequisite.low_current_led_test",
        "approval.actual_led_connection",
        "approval.camera_trigger_connection",
        "approval.nonzero_led_current_setpoint",
        "approval.common_reference_or_isolation_plan"
      ],
      "prohibited_actions": [
        "guessing controller pins, rails, LED part numbers, current limits, output types, or output states",
        "connecting actual white, red, or green LEDs",
        "requesting nonzero LED current setpoints",
        "connecting a camera trigger input",
        "driving camera trigger output",
        "using controller-board rails for LED power",
        "skipping dummy-load or high-impedance LED-driver tests",
        "skipping first low-current LED test prerequisites"
      ],
      "evidence_fields_required": [
        "camera trigger voltage requirement, polarity, pulse-width requirement, output type, protection or level shifting, boot/reset state, dummy-signal plan, and oscilloscope test point",
        "white, red, and green LED installed part or measured safe-current evidence, forward voltage, thermal path, current limit, driver output connector mapping, output type, polarity, boot/reset state, and fault/default behavior",
        "LED supply voltage, available current budget, source identity, overcurrent protection, measurement method, and reviewer/source reference",
        "dummy-load or high-impedance measurement plan, dummy load value or instrument impedance, current-sense test point, current-limit calculation, and pass/fail threshold",
        "first low-current LED test approval with current setpoint, pulse width or duty cycle, duration, temperature observation plan, stop criteria, and reviewer approval"
      ]
    }
  ],
  "entries": [
    {
      "id": "pin_mapping.mks.pa9.green_gate",
      "category": "pin_mapping",
      "subject": "MKS Robin Mini V2.0 PA9 gate assignment",
      "status": "known",
      "value": {
        "controller": "MKS Robin Mini V2.0",
        "pin": "PA9",
        "connector_label": "WiFi TXD1",
        "signal": "GREEN LED gate",
        "channel": "AF_GREEN",
        "polarity": "positive"
      },
      "evidence_refs": [
        "electronics/led-driver/rev-a5-arduino-pwm-brightness-controller.md"
      ]
    },
    {
      "id": "pin_mapping.mks.pa10.red_gate",
      "category": "pin_mapping",
      "subject": "MKS Robin Mini V2.0 PA10 gate assignment",
      "status": "known",
      "value": {
        "controller": "MKS Robin Mini V2.0",
        "pin": "PA10",
        "connector_label": "WiFi RXD1",
        "signal": "RED LED gate",
        "channel": "AF_RED",
        "polarity": "positive"
      },
      "evidence_refs": [
        "electronics/led-driver/rev-a5-arduino-pwm-brightness-controller.md"
      ]
    },
    {
      "id": "pin_mapping.mks.pb13.white_gate",
      "category": "pin_mapping",
      "subject": "MKS Robin Mini V2.0 PB13 gate assignment",
      "status": "known",
      "value": {
        "controller": "MKS Robin Mini V2.0",
        "pin": "PB13",
        "connector_label": "TC1 SCK",
        "signal": "WHITE LED gate",
        "channel": "WHITE_BF",
        "polarity": "positive"
      },
      "evidence_refs": [
        "electronics/led-driver/rev-a5-arduino-pwm-brightness-controller.md"
      ]
    },
    {
      "id": "pin_mapping.mks.pd6.camera_trigger",
      "category": "pin_mapping",
      "subject": "MKS Robin Mini V2.0 PD6 camera/sync trigger assignment",
      "status": "known",
      "value": {
        "controller": "MKS Robin Mini V2.0",
        "pin": "PD6",
        "connector_label": "E0_STEP",
        "signal": "camera/sync trigger",
        "channel": "CAMERA_TRIGGER"
      },
      "evidence_refs": [
        "electronics/led-driver/rev-a5-arduino-pwm-brightness-controller.md"
      ]
    },
    {
      "id": "output_type.camera_trigger",
      "category": "output_type",
      "subject": "Camera trigger electrical output type",
      "status": "unknown",
      "unknown_reason": "The camera trigger driver topology, voltage domain, source/sink behavior, drive strength, and protection or level shifting have not been recorded.",
      "evidence_refs": [
        "electronics/camera-trigger/README.md"
      ],
      "blocks": [
        "trigger_led_no_guess_gate"
      ],
      "evidence_fields_required": [
        "driver topology",
        "voltage domain",
        "source, sink, push-pull, open-drain, optocoupled, or buffered behavior",
        "drive strength or current limit",
        "protection or level-shifting design",
        "reviewed source for the exact target circuit"
      ]
    },
    {
      "id": "output_type.af_red_led_gate",
      "category": "output_type",
      "subject": "AF_RED LED gate electrical output type",
      "status": "unknown",
      "unknown_reason": "The red LED gate driver output type, voltage domain, source/sink behavior, drive strength, and protection or buffering have not been recorded.",
      "evidence_refs": [
        "electronics/led-driver/rev-a5-arduino-pwm-brightness-controller.md"
      ],
      "blocks": [
        "trigger_led_no_guess_gate"
      ],
      "evidence_fields_required": [
        "driver topology",
        "voltage domain",
        "source, sink, push-pull, open-drain, optocoupled, or buffered behavior",
        "drive strength or current limit",
        "gate polarity",
        "reviewed source for the exact target circuit"
      ]
    },
    {
      "id": "output_type.af_green_led_gate",
      "category": "output_type",
      "subject": "AF_GREEN LED gate electrical output type",
      "status": "unknown",
      "unknown_reason": "The green LED gate driver output type, voltage domain, source/sink behavior, drive strength, and protection or buffering have not been recorded.",
      "evidence_refs": [
        "electronics/led-driver/rev-a5-arduino-pwm-brightness-controller.md"
      ],
      "blocks": [
        "trigger_led_no_guess_gate"
      ],
      "evidence_fields_required": [
        "driver topology",
        "voltage domain",
        "source, sink, push-pull, open-drain, optocoupled, or buffered behavior",
        "drive strength or current limit",
        "gate polarity",
        "reviewed source for the exact target circuit"
      ]
    },
    {
      "id": "output_type.white_bf_led_gate",
      "category": "output_type",
      "subject": "WHITE_BF LED gate electrical output type",
      "status": "unknown",
      "unknown_reason": "The white LED gate driver output type, voltage domain, source/sink behavior, drive strength, and protection or buffering have not been recorded.",
      "evidence_refs": [
        "electronics/led-driver/rev-a5-arduino-pwm-brightness-controller.md"
      ],
      "blocks": [
        "trigger_led_no_guess_gate"
      ],
      "evidence_fields_required": [
        "driver topology",
        "voltage domain",
        "source, sink, push-pull, open-drain, optocoupled, or buffered behavior",
        "drive strength or current limit",
        "gate polarity",
        "reviewed source for the exact target circuit"
      ]
    },
    {
      "id": "led_current_limit.af_red",
      "category": "led_current_limit",
      "subject": "AF_RED maximum safe LED current",
      "status": "unknown",